{
  "accepted_updates": [
    {
      "acceptance_basis": "LEGACY_MANIFEST_ACCEPTED_PRE_REGISTRAR",
      "evidence_cutoff": "2026-09-05T00:34:00-04:00",
      "known_at": "2026-09-05T00:34:00-04:00",
      "lineage_sha256": "cc91750cb8c905d6aae2da2adf44cfaa55053eb56e824f2a1b6c9affa9b0f606",
      "packet_id": "UPD-20260905-GATE3-CORRECTIONS",
      "path": "data/canonical-updates/UPD-20260905-GATE3-CORRECTIONS.json",
      "previous_lineage_sha256": "25952a5181f9f355c347e7c5b8b76d3b2fea0e4a1c04211b4121cbb72deebb07",
      "sequence": 1,
      "sha256": "3c1b962fcf28899b80ff132d37334005ed501c05aa64edf7d08ca2cb397605df"
    },
    {
      "acceptance_basis": "LEGACY_MANIFEST_ACCEPTED_PRE_REGISTRAR",
      "evidence_cutoff": "2026-09-05T00:35:00-04:00",
      "known_at": "2026-09-05T00:35:00-04:00",
      "lineage_sha256": "5ac7531bf981a1c4efe240510114689720eb3035ca172e3e588fd3e8f9cf553a",
      "packet_id": "UPD-20260905-GATE3-INFORMATION",
      "path": "data/canonical-updates/UPD-20260905-GATE3-INFORMATION.json",
      "previous_lineage_sha256": "cc91750cb8c905d6aae2da2adf44cfaa55053eb56e824f2a1b6c9affa9b0f606",
      "sequence": 2,
      "sha256": "e7c45fb298b46c85667185102342ef5a78e1ecaf1425e866692ec7927c86feec"
    },
    {
      "acceptance_basis": "LEGACY_MANIFEST_ACCEPTED_PRE_REGISTRAR",
      "evidence_cutoff": "2026-09-05T00:36:00-04:00",
      "known_at": "2026-09-05T00:36:00-04:00",
      "lineage_sha256": "cdad0b3fe062d3135f9b4b5164b678ae43f7a9e8c0c76b501f4a1a06ea5d3f4d",
      "packet_id": "UPD-20260905-GATE3-CURRENT-A",
      "path": "data/canonical-updates/UPD-20260905-GATE3-CURRENT-A.json",
      "previous_lineage_sha256": "5ac7531bf981a1c4efe240510114689720eb3035ca172e3e588fd3e8f9cf553a",
      "sequence": 3,
      "sha256": "d523ac03c919546f7cc8a90e26c6acfe40c0740d978cb54f8c1758a060fa47de"
    },
    {
      "acceptance_basis": "LEGACY_MANIFEST_ACCEPTED_PRE_REGISTRAR",
      "evidence_cutoff": "2026-09-05T00:37:00-04:00",
      "known_at": "2026-09-05T00:37:00-04:00",
      "lineage_sha256": "28aeebc2c49c42534d57a3f20158d2a7e6402384b1f3b2715b8d376417dcc7b7",
      "packet_id": "UPD-20260905-GATE3-CURRENT-B",
      "path": "data/canonical-updates/UPD-20260905-GATE3-CURRENT-B.json",
      "previous_lineage_sha256": "cdad0b3fe062d3135f9b4b5164b678ae43f7a9e8c0c76b501f4a1a06ea5d3f4d",
      "sequence": 4,
      "sha256": "5e9bbb078e7a740db6d8bafbd1065d8fa171a4aa3968d2916164522e89b3bfa3"
    },
    {
      "acceptance_basis": "LEGACY_MANIFEST_ACCEPTED_PRE_REGISTRAR",
      "evidence_cutoff": "2026-09-06T14:10:43-04:00",
      "known_at": "2026-09-06T14:10:43-04:00",
      "lineage_sha256": "604bd8e4922325e751b7d7fd460883ec9b7b5d6ffd4f131bfae0631834d3d1e3",
      "packet_id": "UPD-20260906-CURRENT",
      "path": "data/canonical-updates/UPD-20260906-CURRENT.json",
      "previous_lineage_sha256": "28aeebc2c49c42534d57a3f20158d2a7e6402384b1f3b2715b8d376417dcc7b7",
      "sequence": 5,
      "sha256": "b0760685e1e2e726395d7786d1a7caf05c8ecd661881d2444f3f53a0a86754cd"
    },
    {
      "acceptance_basis": "PACKET_STATUS_ACCEPTED",
      "evidence_cutoff": "2026-09-07T23:59:59-04:00",
      "known_at": "2026-09-09T09:29:59-04:00",
      "lineage_sha256": "4ab593b9b52fa72594402fa96273c7b57fe763893f625a290dea9b545c577c27",
      "packet_id": "UPD-20260907-CATCHUP",
      "path": "data/canonical-updates/UPD-20260907-CATCHUP.json",
      "previous_lineage_sha256": "604bd8e4922325e751b7d7fd460883ec9b7b5d6ffd4f131bfae0631834d3d1e3",
      "sequence": 6,
      "sha256": "9e899ffeb40ede8760e8efbc742d404d5faaf6ebcd851c33c3c4163e7cee0ce3"
    },
    {
      "acceptance_basis": "PACKET_STATUS_ACCEPTED",
      "evidence_cutoff": "2026-09-08T23:59:59-04:00",
      "known_at": "2026-09-09T09:30:01-04:00",
      "lineage_sha256": "003e8dba917cfddd9c35768a7498b41d3a43227b9d93fd6bf010173716f155c6",
      "packet_id": "UPD-20260908-CATCHUP",
      "path": "data/canonical-updates/UPD-20260908-CATCHUP.json",
      "previous_lineage_sha256": "4ab593b9b52fa72594402fa96273c7b57fe763893f625a290dea9b545c577c27",
      "sequence": 7,
      "sha256": "f9e44559bbc54bc9fc2d7de248146fb77da7e079d41053a0b282eb2fb2d7954b"
    },
    {
      "acceptance_basis": "PACKET_STATUS_ACCEPTED",
      "evidence_cutoff": "2026-09-09T09:30:02-04:00",
      "known_at": "2026-09-09T09:30:02-04:00",
      "lineage_sha256": "d6250ba785c7480f59058b3e6292fad608c9390d47c3ab7cab60fd57c239d4eb",
      "packet_id": "UPD-20260909-CATCHUP",
      "path": "data/canonical-updates/UPD-20260909-CATCHUP.json",
      "previous_lineage_sha256": "003e8dba917cfddd9c35768a7498b41d3a43227b9d93fd6bf010173716f155c6",
      "sequence": 8,
      "sha256": "714ae5a45e4f90c5d69bf7d39e5e31e85f62373b5f5ecb778213742a452ba6c7"
    },
    {
      "acceptance_basis": "PACKET_STATUS_ACCEPTED",
      "evidence_cutoff": "2026-09-11T18:00:00-04:00",
      "known_at": "2026-09-11T18:19:00-04:00",
      "lineage_sha256": "f44f787940978c3fe7c857e16063da3fcc3aa5bc0233cd3d9722164fe3f5eaa9",
      "packet_id": "UPD-20260911-EVIDENCE-CONVERGENCE",
      "path": "data/canonical-updates/UPD-20260911-EVIDENCE-CONVERGENCE.json",
      "previous_lineage_sha256": "d6250ba785c7480f59058b3e6292fad608c9390d47c3ab7cab60fd57c239d4eb",
      "sequence": 9,
      "sha256": "35893b411096f7da79214350cad43b4a3ddadb4aab76c76edd407c87caf21f2d"
    },
    {
      "acceptance_basis": "PACKET_STATUS_ACCEPTED",
      "evidence_cutoff": "2026-09-13T12:00:00-04:00",
      "known_at": "2026-09-13T13:42:00-04:00",
      "lineage_sha256": "b2c2646ffeffa0d7f5c17a6b377aa1f8f3c47529bbbc66bb22f681ca7e202e35",
      "packet_id": "UPD-20260913-ROOK-LOCKER",
      "path": "data/canonical-updates/UPD-20260913-ROOK-LOCKER.json",
      "previous_lineage_sha256": "f44f787940978c3fe7c857e16063da3fcc3aa5bc0233cd3d9722164fe3f5eaa9",
      "sequence": 10,
      "sha256": "9793ef438273808434073b971c4355c556a288be1a5c985f5d21c21e4d8434dc"
    },
    {
      "acceptance_basis": "PACKET_STATUS_ACCEPTED",
      "evidence_cutoff": "2026-09-14T00:00:00-04:00",
      "known_at": "2026-09-14T15:37:30-04:00",
      "lineage_sha256": "10b4065abc26e878531b4b86b2e5ce23b41d4211d9a7be785e5f09667edda578",
      "packet_id": "UPD-20260914-ROOK-0000ET",
      "path": "data/canonical-updates/UPD-20260914-ROOK-0000ET.json",
      "previous_lineage_sha256": "b2c2646ffeffa0d7f5c17a6b377aa1f8f3c47529bbbc66bb22f681ca7e202e35",
      "sequence": 11,
      "sha256": "f54c5059c6e0b4b88a6d05d8671f0de790f400bcf373ac84dbc3afa32c164249"
    },
    {
      "acceptance_basis": "PACKET_STATUS_ACCEPTED",
      "evidence_cutoff": "2026-09-14T12:01:03-04:00",
      "known_at": "2026-09-14T15:37:31-04:00",
      "lineage_sha256": "9b616dae5fcc6bf106d603839a7b38e5a521a635e2fc86b4d0c64caace98bc4e",
      "packet_id": "UPD-20260914-ROOK-1201ET",
      "path": "data/canonical-updates/UPD-20260914-ROOK-1201ET.json",
      "previous_lineage_sha256": "10b4065abc26e878531b4b86b2e5ce23b41d4211d9a7be785e5f09667edda578",
      "sequence": 12,
      "sha256": "1d4178f81f3e476c5df6e898f7d2c9664ec81767b2c87296a10e7730a9418727"
    },
    {
      "acceptance_basis": "PACKET_STATUS_ACCEPTED",
      "evidence_cutoff": "2026-09-15T00:01:51-04:00",
      "known_at": "2026-09-15T00:01:51-04:00",
      "lineage_sha256": "7d97446f7f3ed99b215b767b8a602804de8e07793e74faa0cf048c38f46526c4",
      "packet_id": "UPD-20260915-ROOK-0001ET",
      "path": "data/canonical-updates/UPD-20260915-ROOK-0001ET.json",
      "previous_lineage_sha256": "9b616dae5fcc6bf106d603839a7b38e5a521a635e2fc86b4d0c64caace98bc4e",
      "sequence": 13,
      "sha256": "fdf8f8d81fe2392acbf1a52e5a909334eac24f5cb58286386e45b883b2738707"
    },
    {
      "acceptance_basis": "PACKET_STATUS_ACCEPTED",
      "evidence_cutoff": "2026-09-17T16:00:00-04:00",
      "known_at": "2026-09-17T16:12:21-04:00",
      "lineage_sha256": "e425467033b4ca1c020109143f1ff1c43f57c4bc221faae78def98980d5c2c5c",
      "packet_id": "UPD-20260917-ISSUE132-EVIDENCE",
      "path": "data/canonical-updates/UPD-20260917-ISSUE132-EVIDENCE.json",
      "previous_lineage_sha256": "7d97446f7f3ed99b215b767b8a602804de8e07793e74faa0cf048c38f46526c4",
      "sequence": 14,
      "sha256": "55abab3d4aadba14228abf2ee2672d9b5920bab8bd909431e72341e803f1f68f"
    },
    {
      "acceptance_basis": "PACKET_STATUS_ACCEPTED",
      "evidence_cutoff": "2026-09-18T10:27:26-04:00",
      "known_at": "2026-09-18T10:27:26-04:00",
      "lineage_sha256": "614c534716be696ab7cc7c618f579b72fe0f4b5630e7ee615c99d1764e656e17",
      "packet_id": "UPD-20260918-ISSUE140-READJUDICATION",
      "path": "data/canonical-updates/UPD-20260918-ISSUE140-READJUDICATION.json",
      "previous_lineage_sha256": "e425467033b4ca1c020109143f1ff1c43f57c4bc221faae78def98980d5c2c5c",
      "sequence": 15,
      "sha256": "90565d34650b4b9df0cfda931df0c3ab50de3b380acb81b7064ae3532d61ed99"
    },
    {
      "acceptance_basis": "PACKET_STATUS_ACCEPTED",
      "evidence_cutoff": "2026-09-18T10:27:26-04:00",
      "known_at": "2026-09-19T16:00:00-04:00",
      "lineage_sha256": "45b32b40f6a6c45f021a8a118032047b0b55ff9e578c40886cc21eaebd62ca35",
      "packet_id": "UPD-20260919-LIE-LEDGER-SOURCE-COMPLETION",
      "path": "data/canonical-updates/UPD-20260919-LIE-LEDGER-SOURCE-COMPLETION.json",
      "previous_lineage_sha256": "614c534716be696ab7cc7c618f579b72fe0f4b5630e7ee615c99d1764e656e17",
      "sequence": 16,
      "sha256": "8227d0dc2eb4d5af932166046b599afbef1bfdd06733a523bcda258b73a72b94"
    },
    {
      "acceptance_basis": "PACKET_STATUS_ACCEPTED",
      "evidence_cutoff": "2026-09-20T12:28:00-04:00",
      "known_at": "2026-09-20T12:28:00-04:00",
      "lineage_sha256": "aa4937af5baa36a9d4b1acc8a63511bac8d14180ee77be20828cbb2cc7b72ac3",
      "packet_id": "UPD-20260920-F15E-ISFAHAN-EVIDENCE",
      "path": "data/canonical-updates/UPD-20260920-F15E-ISFAHAN-EVIDENCE.json",
      "previous_lineage_sha256": "45b32b40f6a6c45f021a8a118032047b0b55ff9e578c40886cc21eaebd62ca35",
      "sequence": 17,